"","name","price","ratings","reviews"
"1","1.2M Kid's Adjustable Rectangle Blue Table & 4 Mixed Chairs Set","$268.60","4.5 out of 5 stars.","1"
"2","Yamazen GRT-80601T(NB) Kotatsu Table, Width 31.5 x Depth 23.6 inches (80 x 60 cm), Rectangle, USB Outlet Tap, Intermediate Switch, Temperature Adjustment, Stepless Cord Storage Box, Natural Brown","$48.44","4.5 out of 5 stars.","1"
"3","1.2M Kid's Adjustable Rectangle Red Table & 4 Mixed Chairs Set","$66.03","4.5 out of 5 stars.","40,991"
"4","Furinno Just 3-Tier Turn-N-Tube End Table/Side Table/Night Stand/Bedside Table with Plastic Poles, 1-Pack, French Oak Grey/Black","$33.83","4.0 out of 5 stars","49,702"
"5","Furinno Andrey End Table/Side Table/Night Stand/Bedside Table with Bin Drawer, Espresso/Brown","$124.56","3.0 out of 5 stars","1,137"
"6","Furinno Turn-N-Tube U Shape Sofa Side Table with Casters, Espresso/Black","$21.86","4.5 out of 5 stars","1"
"7","120x60cm Wooden Timber Kids Table & 2 Wooden Chairs Set Study Desk Pinewood","$74.64","4.1 out of 5 stars","15"
"8","120x60cm Wooden Timber Kids Table & 4 Wooden Chairs Set Study Desk Pinewood","$168.17","4.3 out of 5 stars","861"
"9","ELEGANT TV Unit Industrial TV Cabinet with 6 Drawers Organiser Storage Oak White TV Stand 180cm TV Table Entertainment Unit Shelf Organiser Cupboard Home Living Room Bedroom Furniture","$36.81","5.0 out of 5 stars","319"
"10","VECELO Folding TV Trays Set of 2, Snack Eating Tables with Cup Holder, Suitable for Couch, Kitchen, Living Room and Bedroom, Stable Metal Frame, Easy Assembly and Storage, Pink","$95.24","4.2 out of 5 stars","1,043"
"11","Furino Turn-N-Tube French Oak Gray/Black/Black Tall Side Table","$82.33","4.3 out of 5 stars","79"
"12","Marco Furniture 1 Piece Moon Coffee Table Walnut Veneer Wood - Round Coffee Table for Living Room, Modern Lift Top Nordic White Sintered Stone Smart Coffee Table Size : L80 X W80 X H41 cm (White)","$110.02","4.0 out of 5 stars","214"
"13","OSJ Round Dining Set, 3-Piece Set, Dining Table, Dining Table, 2 Chairs, Width 27.6 inches (70 cm), Compact Size, 2 Seater, Stylish, New Life","$114.29","3.9 out of 5 stars","992"
"14","Yamazaki Home Narrow Living Room End Table - Slim Side Storage Shelf Stand Furniture Metal and Wood Modern Skinny Accent Table Steel + WoodWhite","$81.20","3.9 out of 5 stars","6,106"
"15","Yamazen BST-30R (OK/WH) Side Table, Slim, Finished Product, U-Shaped, Lightweight, Diameter 13.0 x Height 20.7 inches (33 x 52.5 cm), Bed Table, Side Table, Oak","$126.87","4.1 out of 5 stars","131"
"16","ELEGANT Bedside Table with a Drawers White Wooden Bed Side Table Nightstand High Gloss Chest of Drawers 46.5x45x35cm Sofa Side End Table for Bedroom, Living Room, Hallway","$32.48","4.1 out of 5 stars","4,705"
"17","Yamazen BST-5030C(NA) Telework Side Table, Casters Included, Storage Shelf, U-Shaped, Width 19.7 x Depth 11.8 x Height 23.6 inches (50 x 30 x 60 cm), Bed Table, Sofa Table, Living Alone, Natural,","$140.01","4.3 out of 5 stars","356"
"18","Furino 17017 Turn-N-Tube End Table, Espresso, Width 15.8 x Depth 11.8 x Height 27.8 inches (40.1 x 30.0 x 70.4 cm)","$97.77","4.2 out of 5 stars","137"
"19","HOOBRO Side Table, Slim Gold Side Table, Small Coffee Snack Table, Sofa End Table with Fabric Magazine Holder, Bedside Table for Small Spaces, Bedroom, Living Room, Gold EGD66BZ01","$186.13","4.7 out of 5 stars","156"
"20","Hagihara MT-6864WS Low Table, Center Table, Table Desk, Wood Grain Top & Cat Legs Steel Legs, Folding, Finished Product, Lightweight, Cute, Living Room, Sofa Table, Width 31.5 inches (80 cm), Oval,","$111.75","4.1 out of 5 stars","3"
"21","Delta Children Kids Table and Chair Set with Storage (2 Chairs Included) - Ideal for Arts & Crafts, Snack Time, Homeschooling, Homework & More, Peppa Pig","$411.52","4.7 out of 5 stars","317"
"22","Fuji Boeki 14432 Folding Low Table, Round, Width 23.6 inches (60 cm), Black","$96.69","4.0 out of 5 stars","10"
"23","VECELO Tall End Side Table, 30"" Height Nightstand with 3-Tier Storage Shelf for Living Room Bedroom Office Hallway Study, Carbon Grey","$90.42","5.0 out of 5 stars","4,357"
"24","Furino Jaya French Oak Gray Side Table, Utility Design","$55.37","4.7 out of 5 stars","991"
"25","Artiss Bedside Table Mirrored Side Tables Storage Small Narrow Desk Chest of Drawers, with 3 Drawer, Bedroom Living Room Home Furniture Tallboy Lamp Stand Nightstand Cabinet, 30 x 60cm","$118.42","3.9 out of 5 stars","692"
"26","VECELO Tall End Side Tables,30"" Height Nightstand with 3-Tier Storage Shelf for Bedroom Living Room Kitchen Hallway Study, Easy Assembly,Industrial Style, Misty Gray","$68.36","4.3 out of 5 stars","3"
"27","Kid's Adjustable Square Pink Table & 4 Pink Chairs Set","$39.82","4.5 out of 5 stars","6"
"28","Table No. 21","$67.49","4.3 out of 5 stars","88"
"29","Furinno Turn-N-Tube End Table, Dark Cherry/Black, Set of 2, Width 13.4 x Depth 13.4 x Height 19.7 inches (34 x 34 x 50 cm)","$446.08","5.0 out of 5 stars","77"
"30","Hagiwara LT-4918LBR Dining Table, Cafe Table, Dining Table, Dining Table, Wood Grain Top x Steel Legs, Round, Industrial, Width 23.6 inches (60 cm), Light Brown","$310.39","5.0 out of 5 stars","2,428"
"31","Mind Reader Lap Desk Laptop Stand, Bed Tray, Collapsible, Cushion, Portable, Dorm, Plastic, 14.75"" L x 11"" W x 7.3"" H, Red","$74.39","3.7 out of 5 stars","34"
"32","VECELO Nightstands Set of 2 Modern Bedside End Tables, Night Stands with Drawer and Storage Shelf for Living Room Bedroom, Industrial Metal Frame, 2 Pack, Walnut Brown",NA,"4.2 out of 5 stars","254"
"33","1.2M Kid's Adjustable Rectangle Blue Table & 4 Mixed Chairs Set",NA,"4.3 out of 5 stars","7"
"34","Flash Furniture Bellamy 31.5'' Round Tempered Glass Metal Table, Bronze",NA,"3.7 out of 5 stars","505"
"35","Menage Confort Removable Table Fittings, extendable Table for Kitchen Drawer, Metal, galvanised Steel, para ancho Exterior cajón de 400 a 800 mm",NA,"4.0 out of 5 stars","1,808"
"36","Furino Side Table, Set of 2, White",NA,"3.9 out of 5 stars",NA
"37","FURINO Camnus Modern End Table/Nightstand/Sofa Table/Side Table, French Oak Gray, Width 15.7 x Depth 15.7 x Height 17.9 inches (40.0 x 40.0 x 45.3 cm)",NA,"4.0 out of 5 stars",NA
"38","Iris Ohyama SDT-45 Side Table, U-Shaped Design, Wood Grain, Brown Oak/Black, Width 17.7 x Depth 11.4 x Height 20.5 inches (45 x 29 x 52.2 cm)",NA,"4.1 out of 5 stars",NA
"39","Furinno Nightstand, Side, End Table with Drawer with Handle, Wood, Solid White, 2-Pack",NA,"4 Stars & Up",NA
"40","BLKP N-7815 Pearl Metal Table, Mini, Foldable, Side Table, Width 19.7 x Depth 18.9 x Height 27.6 inches (50 x 48 x 70 cm), High Type, Folding Table, Black",NA,"3 Stars & Up",NA
"41","Artiss Dining Table, Wooden Outdoor Bar Cabinet Coffee Side Tables Storage Shelf Wine Rack Kitchen Hallway Breakfast Pub Bistro Desk Home Indoor Patio Garage Furniture, with 3 Level Shelves White",NA,"2 Stars & Up",NA
"42","120x60cm Kids Pink Height-Adjustable Whiteboard Drawing Table & 4 Pink Chairs",NA,"1 Star & Up",NA
"43","Iris Plaza SDTO-30 Table, Side Table, Slim, Width 11.8 inches (30 cm), 11.8 inches (30 cm), Desk, Shelf, Stylish, Open Type, White",NA,NA,NA
"44","Hagiwara LT-4919WH Dining Table, Cafe Table, Dining Table, Dining Table, Wood Grain Top and Steel Legs, Square, Industrial, Width 23.6 inches (60 cm), White",NA,NA,NA
"45","ELEGANT Dressing Table Stool Set with Mirror 12 LED Bulbs,2 Lighting Modes&Adjustable Brightness,Makeup Desk for Bedroom Dressing Room White",NA,NA,NA
"46","OSJ Dining Table, Round Table, Side Table, Width 31.5 x Height 28.3 inches (80 x 72 cm), Cafe Table, Scratch Resistant, Dirt, Moisture and Heat Resistant, Black","$212.29","4.5 out of 5 stars.","16"
"47","120x60cm Kid's Adjustable Rectangle Table Desk Blue","$138.59","4.5 out of 5 stars.","443"
"48","120x60cm Kids Blue Height-Adjustable Whiteboard Drawing Table & 6 Blue Chairs","$208.93","4.5 out of 5 stars.","1,757"
"49","Kid's Adjustable Square Table Chair 3pc Set-1x Green Table 1xRed Chair 1xYellow Chair","$79.68","3.2 out of 5 stars","899"
"50","Yamazen CDST-3050 (OAK3D) Side Table Rack (with Drawer/Door) Bed, Sofa, Bedroom, Slim, Decorative Shelf, Storage Shelf, Stylish, Width 11.8 x Depth 12.4 x Height 19.7 inches (30 x 31.5 x 50 cm),","$240.95","4.1 out of 5 stars","349"
"51","Signature Home Clip On Tray Sofa Table for Wide Couches. Couch Arm Tray Table, Portable Table, TV Table and Side Tables for Small Spaces. Stable Sofa Arm Table for Eating and Drink Table","$77.11","4.7 out of 5 stars","554"
"52","Hagihara MT-6646WH Low Table Center Table Desk Cat Legs Feminine with Drawers (Can Also Be Used as a Makeup Table), Accessories, Jewelry Storage, White, Width 27.6 x Depth 15.7 x Height 16.9 inches","$4.99","4.0 out of 5 stars","302"
"53","Takeda Corporation T8-VCTH70NA Side Table, Desk, Folding Table, Vintage Natural, 18.9 x 15.7 x 27.6 inches (48 x 40 x 70 cm), Vintage Style Compact Table High","$59.97","4.3 out of 5 stars","1,287"
"54","VECELO Modern, Square End Side Table with Drawer and Storage Space for Bedroom and Living Room, 2 Sets Nightstands, Antique Brown（2 Sets）","$126.80","4.0 out of 5 stars","636"
"55","Iris Plaza CTL-0604 Folding Table, Living Alone, Walnut, Width 23.6 x Depth 15.7 x Height 12.6 inches (60 x 40 x 32 cm), Low Table","$178.42","4.6 out of 5 stars","1,319"
"56","Kid's Adjustable Square Table Chair 3pc Set-1x Yellow Table 2X Yellow Chairs","$154.37","4.4 out of 5 stars","22"
"57","Separate Tables (1958)","$60.56","4.3 out of 5 stars","46"
"58","Foldable Laptop Table, Bed Table for Study and Reading, Lap Desk Table, Breakfast Tray Table, Portable Mini Picnic Table, Folds in Half with Inner Storage Space","$66.83","4.2 out of 5 stars","127"
"59","VECELO Modern Nightstand with Drawer Square End, Side Table for Bedroom, Living Room, Small Space, Night Stand with Open Shelf, Stable Metal Frame, 1 Pack, Black","$73.92","3.6 out of 5 stars","775"
"60","VECELO Night Stands for Bedroom Nightstand Bedside End Tables with Drawer Storage, Rustic Brown","$110.97","3.8 out of 5 stars","349"
"61","VECELO Side Table, Night Table, Bedside Table, Gray, Width 13.8 x Depth 15.7 x Height 21.7 inches (35 x 40 x 55 cm), Drawers, Modern Bedside, Storage Included, Stylish, Simple","$166.98","4.1 out of 5 stars","1,420"
"62","Shirai Sangyo VTL-8040TNN Low Table, Natural Brown, Width 31.5 inches (80 cm), Height 15.0 inches (38.1 cm), Depth 15.6 inches (39.4 cm), Bientage Light","$135.66","4.5 out of 5 stars","680"
"63","Junior Vida Pink & Oak Standard Chipboard Bedside Tables","$65.46","4.3 out of 5 stars","742"
"64","Round Sofa arm Tray Table. Couch Sofa arm Rest Table. Weighted Sides. Fits Over Square Chair arms. (Eva)","$227.41","4.5 out of 5 stars","2,018"
"65","Qlisytpps Coffee Table Small Side Table C Shape Sofa Table Mobile Coffee Table Living Room Table with Metal Frame for Coffee and Laptop Round Table as Storage Surface for Couch and Sofa","$49.22","4.1 out of 5 stars","15"
"66","Haku Möbel Side Table, Metal, Chrome, Diameter 35 x Height 47 cm","$78.59","4.2 out of 5 stars","12"
"67","Yamazaki Home C Compact Steel | End + Side Tables, One Size, White","$92.85","4.0 out of 5 stars","1"
"68","Hagihara LT-4666MWH Low Table Nesting Table Table Round Desk [Marble-style Top x Steel Legs] Chic Modern Living Room Sofa Table Large and Small 2-piece Set White Large 64MWH Width: 25.2 inches (64 cm)","$271.77","4.5 out of 5 stars","1,768"
"69","120x60cm Semi Circle Timber Pinewood Wooden Kids Table Activity Study Desk & 4 Pink Chairs Set","$3.00","3.2 out of 5 stars","18"
"70","D&D Living® Couch Tray 20x14 inch - Large Sofa Armrest Tray Table for Straight Chair Arm - Flexible | Sustainable | Non-Slip (Natural, Bamboo)","$112.46","5.0 out of 5 stars","108"
"71","Artiss Dining Chairs and Table Dining Set 4 Cafe Chairs Set of 5 4 Seater White","$69.73","4.0 out of 5 stars","2"
"72","Yamazen KUT-7040(GWH) Elevating Type Side Table, Height 23.6-37.4 inches (60-95 cm), Low Floor Caster That Enters The Gap of 1.6 inches (4 cm), Gas Pressure Boost, Stepless Height Adjustment,","$67.29","2.9 out of 5 stars","138"
"73","Vida Designs Pine Bedside Table Drawer, Bedside Table, 1 Drawer, Bedside Table, Metal Handles & Runners","$196.06","4.3 out of 5 stars","49"
"74","Iris Ohyama Side Table, Table with Storage, Spacious Room Use, Sofa Side, Bed Side Storage, Small Storage, Single Living Alone, Stylish, Ironwood, Ash Brown, Width 11.8 x Depth 13.7 x Height 16.1","$62.90","4.5 out of 5 stars","4"
"75","Sofa Tray Table with EVA Base and Couch Cup Holder. Remote Control and Cellphone Organizer, Arm Rest Organizer, Arm Rest Table. Fits Over Square Chair arms. (Dark Brown)","$261.33","4.2 out of 5 stars","11"
"76","JOURNAL STANDARD FURNITURE CURL Side Table CURL Side Table Slim","$119.44","4.5 out of 5 stars","3,245"
"77","Wooden Kids Table 4 Pink Chairs","$93.78","3.8 out of 5 stars",NA
"78","The Expert at the Card Table","$282.32","3.8 out of 5 stars",NA
"79","Zinus Modern Studio Collection ET-2020QB Dane Night Table, Dark Espresso, Width 20.1 x Depth 20.1 x Height 20.1 inches (51 x 51 x 51 cm), Side Table, Steel Frame, Bed, Easy Assembly, Tools Included","$31.34","4.1 out of 5 stars",NA
"80","Fuji Boeki 14434 Folding Low Table, Width 23.6 inches (60 cm), Black","$67.13","4 Stars & Up",NA
"81","1.2M Kid's Adjustable Rectangle Yellow Table & 6 Mixed Chairs Set",NA,"3 Stars & Up",NA
"82","120x60cm Kids Red Height-Adjustable Whiteboard Drawing Table",NA,"2 Stars & Up",NA
"83","Furinno Turn-N-Tube Haydn End Table, Amber Pine/Black",NA,"1 Star & Up",NA
"84","Flash Furniture Metal Bar Table - Aluminum Patio Table - Mellie 23.5"" H Round Bar Height Table - Indoor/Outdoor - Black",NA,NA,NA
"85","Hagihara Low Table, Center Table, Table Desk, Stylish Wood Grain Top with Drawers, Double Pulls, Lightweight, Vintage Living Room, Sofa Table, Width 31.5 x Depth 15.7 x Height 14.4 inches (80 x 40 x",NA,NA,NA
"86","Furinno Simple Side Table, Espresso/Black, One Size",NA,NA,NA
"87","Hagihara MT-6181WH Lifting Table, Lifting Table, Gas Pressure Type, Almost Finished Product, Storage, Width 31.5 inches (80 cm), White, 1 Unit",NA,NA,NA
"88","Coffee Bar, Sofa Organiser on Side Tables, Coffee Table, Wooden Coffee Bar as Beer Gifts for Men, Sofa Tray with Two Snack Bowls and Multiple Storage Spaces (Elegant Wood Colour)",NA,NA,NA
"89","Yamazaki 7155 Side Table Wagon, White, Approx. W 10.8 x D 12.6 x H 21.7 inches (27.5 x 32 x 55 cm), Tower with Casters, Magazine Rack, Small Storage",NA,NA,NA
"90","Keter Cool Bar/Cocktail/Coffee 3-in-1 Patio Table, White with Black",NA,NA,NA
"91","Iris Plaza SWD-700 Steel Wood Dining Set, for 2 People, 3-Piece Set, Dining Table, 27.6 inches (70 cm), 1 Piece, 2 Chairs, Walnut/Black, Storage Included, Woodgrain Style, Stylish, Compact, Assembly","$282.32","4.5 out of 5 stars.","4"
"92","Relaxdays Side Table, Storage Shelf, Marble Optic, H x W x D: 38 x 50 x 30 cm, Black","$31.34","4.5 out of 5 stars.","11"
"93","Decorative Wooden Table 36 x 30 cm - Small Side Table Coffee Table - White","$67.13","4.5 out of 5 stars.","3,245"
"94","Hagiwara VT-7969SP Low Table, Folding Table, with Shelf, Finished Product, Living Alone, Compact, Width 35.4 inches (90 cm), Smoky Pink","$189.79","3.8 out of 5 stars","492"
"95","Ovicar Round Side Table - 2 Tiers End Table Metal Coffee Table Small Sofa Side Table Outdoor Indoor Accent Table Nightstand Waterproof Removable Tray Table for Living Room Bedroom Balcony (Black)","$80.69","3.8 out of 5 stars","25"
"96","2 x Lifting Height Lift Up Top Big Coffee Table Desk Lifting Mechanism Hardware Hinge Hydraulic Spring Lifting Frame Buffer Lifting Support Hardware Fitting Furniture","$9.99","4.1 out of 5 stars","2,455"
"97","King Arthur","$291.15","4.5 out of 5 stars","7"
"98","Iris Ohyama SCT-795 Center Table, Desk, Extendable Center Table, Width 31.1-50.9 inches (79-129 cm), Depth 15.0 inches (38 cm), Natural/Black","$80.49","4.2 out of 5 stars","8"
"99","120x60cm Kids Pink Height-Adjustable Whiteboard Drawing Table","$92.26","4.6 out of 5 stars","59"
"100","NITORI KS3 7050 8761096 Simple and Durable Folding Table with Wooden Legs","$68.41","3.5 out of 5 stars","22"
"101","Iris Ohyama STB-288W Side Table, Stylish, Off-White, Product Size (W x D x H): Approx. 15.2 x 11.4 x 24.4 inches (38.5 x 29 x 62 cm)","$142.82","3.8 out of 5 stars","7,027"
"102","Shamrock Home Bamboo Couch Arm Table with Device Holder, Clip On Tray Sofa Table for Couches. Sofa Arm Tray for TV Dinners, Remotes, Drinks, Snacks and Small Spaces (Black, Regular 13.75 x 9.5)","$43.71","3.8 out of 5 stars","9"
"103","Furinno Turn-N-Tube End Table, Dark Cherry/Black, 1-Pack","$38.96","4.7 out of 5 stars","11"
"104","Hagihara VT-7922-75NA Low Table, Foldable, Compact, Natural, Width 29.5 inches (75 cm), 1 Unit","$43.44","4.5 out of 5 stars","146"
"105","Fuji Boeki 71866 Wire Table, Width 31.5 x Depth 16.5 x Height 15.7 inches (80 x 42 x 40 cm), Middle Brown, No Tools Needed","$111.99","4.1 out of 5 stars","269"
"106","Wooden Kids Table 4 Mixed Chairs","$58.11","4.8 out of 5 stars","273"
"107","Mitsuwa PL-M60BR Palette Table, Width 23.6 x Depth 17.7 x Height 12.2 inches (60 x 45 x 31 cm), Brown, Made in","$141.73","4.1 out of 5 stars","136"
"108","Furinno End, Side Table, Nightstand, Engineered Wood, Solid White/White, 38.6(W) x 51.1(H) x 39.9(D) cm","$136.78","4.4 out of 5 stars","312"
"109","VECELO Side Table, Night Table, Bedside Table, Set of 2, Brown, 15.7 x 15.7 x 21.7 inches (40 x 40 x 55 cm), Stylish, Simple, Scandinavian Style, Glass Top, Sofa Side, Bedside","$118.07","4.1 out of 5 stars","2,209"
"110","Furinno JP Furinno Side Table, Simplistic Espresso/Black, Small","$53.03","4.1 out of 5 stars","2"
"111","Melissa & Doug First Play Jungle Wooden Activity Table, Baby and Toddler Toy, Sturdy Wooden Construction, Helps Develop Fine Motor Skills","$81.82","3.9 out of 5 stars","503"
"112","120x60cm Kids Pink Height-Adjustable Whiteboard Drawing Table & 6 Pink Chairs","$180.61","4.1 out of 5 stars","5"
"113","Square Wooden Timber Kids Table Childrens Study Activity Desk Pinewood 60x60cm","$181.28","3.0 out of 5 stars","36"
"114","Furino Turn-N-Tube Living Table French Oak Gray/Black/Black","$111.64","4.2 out of 5 stars","18"
"115","Ikea Varnished Side Table in White; (35 x 35 cm)","$39.87","3.9 out of 5 stars","7"
"116","Sultan's Dishes Table","$74.86","4.2 out of 5 stars","2"
"117","FURINNO Camnus Modern Living Coffee Table, Americano","$139.52","3.7 out of 5 stars","1"
"118","Takeda Corporation T1-D4530BK [Chabu Table/Folding/Low Table] Black 17.7 x 11.8 x 7.1 inches (45 x 30 x 18 cm), Folding Table 45, Marble Pattern","$189.99","4.6 out of 5 stars","318"
"119","OSJ Glass Table, Coffee Table, Width 38.6 inches (98 cm), Tempered Glass Top Plate (Clear Glass + Black Legs)","$59.29","2.8 out of 5 stars","726"
"120","Hagihara Low Table, Nesting Table, Table, Square, Desk, Chic Modern, Living Room Sofa Table, Large, Medium, Small, 3-piece Set, Black, Large, 45 W, Medium: Width 15.7 inches (40 cm), Small: Width 13.8","$73.64","5.0 out of 5 stars","3,911"
"121","Hagihara LST-4667MWH Low Table Nest Table Table Square Desk [Marble Top x Steel Legs] Chic Modern Living Room Sofa Table Large, Medium, Small, 3-Piece Set, White, Large, Width 17.7 inches (45 cm),","$145.00","4.6 out of 5 stars","2,036"
"122","MeHome Sonoma Coffee Table, 67 x 67 x 40 cm, Sofa Table, Side Table, Coffee Table, Tea Table, Industrial Style, Modern Living Room Table with Two Shelves, Office and Home","$105.49","4.3 out of 5 stars","409"
"123","Yamazen MST-5040 (MBRMBR) Folding Mini Table with Casters, Dark Brown","$120.80","3.6 out of 5 stars","53"
"124","OSJ BTM Glass Table, Low Table, Coffee Table, Center Table, Width 34.6 inches (88 cm), Tempered Glass Top Plate, Storage Shelf Included","$179.88","4.6 out of 5 stars",NA
"125","YAMAZAKI home Sliding Sofa c end Table/Coffee Tray/Laptop Desk, Steel, White, One Size","$206.85","4.4 out of 5 stars",NA
"126","Takeda Corporation MASH-470 Mushroom Table, Garden, Exterior Garden, Red, 18.5 x 18.5 x 22.0 inches (47 x 47 x 56 cm)","$179.92","4.4 out of 5 stars",NA
"127","1.2M Kid's Adjustable Rectangle Blue Table & 6 Mixed Chairs Set","$71.36","4 Stars & Up",NA
"128","Takeda Corporation B2-NT60BK Nest Table, Low Table, Cute, Marble, Black, 23.8 x 23.8 x 16.7 inches (60.4 x 60.4 x 42.5 cm), Marble Pattern, Black",NA,"3 Stars & Up",NA
"129","Fouvin Bedside Table Shelf for Bedside Table Bedside Table Hanging Bedside Tray Organiser Retractable and Foldable for Books Fabric Toy Mobile Phone Headphones Bed Shelf Yellow 30 x 21 x 7 cm",NA,"2 Stars & Up",NA
"130","Bamboo Sofa Arm Tray Table- Anti-Slip, Flexible Table for All Armrests- Durable Couch Arm Table with an Elegant Design, Natural Color, Fits Any Interiors- Sofa Armrest Tray for Drinks",NA,"1 Star & Up",NA
"131","RICOO PC Calculator Holder for Under-Table Desk Computer Mounting TRH-02 CPU Housing Holder up to 35 kg Standing/Lying Under Table Mount Rack Base Vertical/Horizontal",NA,NA,NA
"132","Tornado Side Table",NA,NA,NA
"133","Furinno Jaya 2-15019WN Oval End Table, Set of Two, Walnut",NA,NA,NA
"134","Minority Report",NA,NA,NA
"135","VECELO Corner Cabinet/Table, 3-Tier Shelves with Protection Door, Metal Frame Storage Shelf Organizer for Small Space, Living Room, Kitchen, Bathroom, Set of 1, Gold",NA,NA,NA
"136","Iris Plaza SWD-700 Steel Wood Dining Set, for 2 People, 3-Piece Set, Dining Table, 27.6 inches (70 cm), 1 Piece, 2 Chairs, Walnut/Black, Storage Included, Woodgrain Style, Stylish, Compact, Assembly","$282.32","4.5 out of 5 stars.","4"
"137","Relaxdays Side Table, Storage Shelf, Marble Optic, H x W x D: 38 x 50 x 30 cm, Black","$31.34","4.5 out of 5 stars.","11"
"138","Decorative Wooden Table 36 x 30 cm - Small Side Table Coffee Table - White","$67.13","4.5 out of 5 stars.","3,245"
"139","Hagiwara VT-7969SP Low Table, Folding Table, with Shelf, Finished Product, Living Alone, Compact, Width 35.4 inches (90 cm), Smoky Pink","$189.79","3.8 out of 5 stars","492"
"140","Ovicar Round Side Table - 2 Tiers End Table Metal Coffee Table Small Sofa Side Table Outdoor Indoor Accent Table Nightstand Waterproof Removable Tray Table for Living Room Bedroom Balcony (Black)","$80.69","3.8 out of 5 stars","25"
"141","2 x Lifting Height Lift Up Top Big Coffee Table Desk Lifting Mechanism Hardware Hinge Hydraulic Spring Lifting Frame Buffer Lifting Support Hardware Fitting Furniture","$9.99","4.1 out of 5 stars","2,455"
"142","King Arthur","$291.15","4.5 out of 5 stars","7"
"143","Iris Ohyama SCT-795 Center Table, Desk, Extendable Center Table, Width 31.1-50.9 inches (79-129 cm), Depth 15.0 inches (38 cm), Natural/Black","$80.49","4.2 out of 5 stars","8"
"144","120x60cm Kids Pink Height-Adjustable Whiteboard Drawing Table","$92.26","4.6 out of 5 stars","59"
"145","NITORI KS3 7050 8761096 Simple and Durable Folding Table with Wooden Legs","$68.41","3.5 out of 5 stars","22"
"146","Iris Ohyama STB-288W Side Table, Stylish, Off-White, Product Size (W x D x H): Approx. 15.2 x 11.4 x 24.4 inches (38.5 x 29 x 62 cm)","$142.82","3.8 out of 5 stars","7,027"
"147","Shamrock Home Bamboo Couch Arm Table with Device Holder, Clip On Tray Sofa Table for Couches. Sofa Arm Tray for TV Dinners, Remotes, Drinks, Snacks and Small Spaces (Black, Regular 13.75 x 9.5)","$43.71","3.8 out of 5 stars","9"
"148","Furinno Turn-N-Tube End Table, Dark Cherry/Black, 1-Pack","$38.96","4.7 out of 5 stars","11"
"149","Hagihara VT-7922-75NA Low Table, Foldable, Compact, Natural, Width 29.5 inches (75 cm), 1 Unit","$43.44","4.5 out of 5 stars","146"
"150","Fuji Boeki 71866 Wire Table, Width 31.5 x Depth 16.5 x Height 15.7 inches (80 x 42 x 40 cm), Middle Brown, No Tools Needed","$111.99","4.1 out of 5 stars","269"
"151","Wooden Kids Table 4 Mixed Chairs","$58.11","4.8 out of 5 stars","273"
"152","Mitsuwa PL-M60BR Palette Table, Width 23.6 x Depth 17.7 x Height 12.2 inches (60 x 45 x 31 cm), Brown, Made in","$141.73","4.1 out of 5 stars","136"
"153","Furinno End, Side Table, Nightstand, Engineered Wood, Solid White/White, 38.6(W) x 51.1(H) x 39.9(D) cm","$136.78","4.4 out of 5 stars","312"
"154","VECELO Side Table, Night Table, Bedside Table, Set of 2, Brown, 15.7 x 15.7 x 21.7 inches (40 x 40 x 55 cm), Stylish, Simple, Scandinavian Style, Glass Top, Sofa Side, Bedside","$118.07","4.1 out of 5 stars","2,209"
"155","Furinno JP Furinno Side Table, Simplistic Espresso/Black, Small","$53.03","4.1 out of 5 stars","2"
"156","Melissa & Doug First Play Jungle Wooden Activity Table, Baby and Toddler Toy, Sturdy Wooden Construction, Helps Develop Fine Motor Skills","$81.82","3.9 out of 5 stars","503"
"157","120x60cm Kids Pink Height-Adjustable Whiteboard Drawing Table & 6 Pink Chairs","$180.61","4.1 out of 5 stars","5"
"158","Square Wooden Timber Kids Table Childrens Study Activity Desk Pinewood 60x60cm","$181.28","3.0 out of 5 stars","36"
"159","Furino Turn-N-Tube Living Table French Oak Gray/Black/Black","$111.64","4.2 out of 5 stars","18"
"160","Ikea Varnished Side Table in White; (35 x 35 cm)","$39.87","3.9 out of 5 stars","7"
"161","Sultan's Dishes Table","$74.86","4.2 out of 5 stars","2"
"162","FURINNO Camnus Modern Living Coffee Table, Americano","$139.52","3.7 out of 5 stars","1"
"163","Takeda Corporation T1-D4530BK [Chabu Table/Folding/Low Table] Black 17.7 x 11.8 x 7.1 inches (45 x 30 x 18 cm), Folding Table 45, Marble Pattern","$189.99","4.6 out of 5 stars","318"
"164","OSJ Glass Table, Coffee Table, Width 38.6 inches (98 cm), Tempered Glass Top Plate (Clear Glass + Black Legs)","$59.29","2.8 out of 5 stars","726"
"165","Hagihara Low Table, Nesting Table, Table, Square, Desk, Chic Modern, Living Room Sofa Table, Large, Medium, Small, 3-piece Set, Black, Large, 45 W, Medium: Width 15.7 inches (40 cm), Small: Width 13.8","$73.64","5.0 out of 5 stars","3,911"
